{
  "schema_version": "0.1",
  "generated_at": "2026-10-02T12:37:37.730101Z",
  "guide_type": "agent_consumable_harness_capability_guide",
  "harness": {
    "id": "openai-agents-sdk-python",
    "name": "OpenAI Agents SDK — Python",
    "vendor": "OpenAI",
    "family": "agent_sdk",
    "lifecycle": "active",
    "current_version": "0.23.0",
    "predecessor": null,
    "successor": null
  },
  "freshness": {
    "last_verified_at": "2026-10-02T05:39:01.371768Z",
    "latest_release_in_registry": "0.23.0",
    "latest_release_published_at": "2026-10-02T01:08:23Z",
    "warning": "Treat unavailable or unknown actor access as unsupported until verified. UI-only capability is not agent-callable by implication."
  },
  "capabilities_by_actor": {
    "human_operator": [
      {
        "capability_id": "execution.sdk_embedding",
        "name": "Embeddable SDK",
        "category": "execution",
        "status": "stable",
        "summary": "Python framework for building agent applications.",
        "surfaces": [
          "Python library"
        ],
        "invocation": [
          "Agent",
          "Runner.run",
          "Runner.run_sync"
        ],
        "minimum_version": null,
        "limitations": [],
        "confidence": "verified_official",
        "evidence": [
          {
            "source_id": "src.openai-agents-python.docs",
            "url": "https://openai.github.io/openai-agents-python/",
            "version": null,
            "verified_at": "2026-08-08T20:00:00Z",
            "claim": "Python framework for building agent applications."
          },
          {
            "source_id": "src.openai-agents-python.docs",
            "url": "https://openai.github.io/openai-agents-python/",
            "version": null,
            "verified_at": "2026-08-26T00:00:00Z",
            "claim": "Invocation verified: Agent, Runner.run, Runner.run_sync"
          }
        ],
        "access": "supported"
      },
      {
        "capability_id": "execution.structured_output",
        "name": "Machine-readable output",
        "category": "execution",
        "status": "stable",
        "summary": "Typed agent results and structured outputs support downstream automation.",
        "surfaces": [
          "typed results"
        ],
        "invocation": [
          "output_type",
          "result.final_output"
        ],
        "minimum_version": null,
        "limitations": [],
        "confidence": "verified_official",
        "evidence": [
          {
            "source_id": "src.openai-agents-python.docs",
            "url": "https://openai.github.io/openai-agents-python/",
            "version": null,
            "verified_at": "2026-08-08T20:00:00Z",
            "claim": "Typed agent results and structured outputs support downstream automation."
          },
          {
            "source_id": "src.openai-agents-python.docs",
            "url": "https://openai.github.io/openai-agents-python/results/",
            "version": null,
            "verified_at": "2026-08-26T00:00:00Z",
            "claim": "Invocation verified: output_type, result.final_output"
          }
        ],
        "access": "supported"
      },
      {
        "capability_id": "extensions.mcp_client",
        "name": "MCP client",
        "category": "extensions",
        "status": "stable",
        "summary": "Agents can connect to MCP servers and expose MCP-backed tools.",
        "surfaces": [
          "MCP"
        ],
        "invocation": [
          "MCPServerStdio",
          "MCPServerSse",
          "MCPServerStreamableHttp",
          "mcp_servers"
        ],
        "minimum_version": null,
        "limitations": [],
        "confidence": "verified_official",
        "evidence": [
          {
            "source_id": "src.openai-agents-python.docs",
            "url": "https://openai.github.io/openai-agents-python/",
            "version": null,
            "verified_at": "2026-08-08T20:00:00Z",
            "claim": "Agents can connect to MCP servers and expose MCP-backed tools."
          },
          {
            "source_id": "src.openai-agents-python.docs",
            "url": "https://openai.github.io/openai-agents-python/mcp/",
            "version": null,
            "verified_at": "2026-08-26T00:00:00Z",
            "claim": "Invocation verified: MCPServerStdio, MCPServerSse, MCPServerStreamableHttp, mcp_servers"
          }
        ],
        "access": "supported"
      },
      {
        "capability_id": "orchestration.subagents",
        "name": "Subagents/delegation",
        "category": "orchestration",
        "status": "stable",
        "summary": "Handoffs and agents-as-tools compose multi-agent workflows.",
        "surfaces": [
          "handoffs",
          "agents as tools"
        ],
        "invocation": [
          "handoffs",
          "Agent.as_tool"
        ],
        "minimum_version": null,
        "limitations": [],
        "confidence": "verified_official",
        "evidence": [
          {
            "source_id": "src.openai-agents-python.docs",
            "url": "https://openai.github.io/openai-agents-python/",
            "version": null,
            "verified_at": "2026-08-08T20:00:00Z",
            "claim": "Handoffs and agents-as-tools compose multi-agent workflows."
          },
          {
            "source_id": "src.openai-agents-python.docs",
            "url": "https://openai.github.io/openai-agents-python/",
            "version": null,
            "verified_at": "2026-08-26T00:00:00Z",
            "claim": "Invocation verified: handoffs, Agent.as_tool"
          }
        ],
        "access": "supported"
      },
      {
        "capability_id": "orchestration.multi_agent_coordination",
        "name": "First-class multi-agent coordination",
        "category": "orchestration",
        "status": "stable",
        "summary": "Supervisor/handoff patterns are first-class in the SDK.",
        "surfaces": [
          "handoffs",
          "routing"
        ],
        "invocation": [
          "handoffs",
          "Agent.as_tool"
        ],
        "minimum_version": null,
        "limitations": [],
        "confidence": "verified_official",
        "evidence": [
          {
            "source_id": "src.openai-agents-python.docs",
            "url": "https://openai.github.io/openai-agents-python/",
            "version": null,
            "verified_at": "2026-08-08T20:00:00Z",
            "claim": "Supervisor/handoff patterns are first-class in the SDK."
          },
          {
            "source_id": "src.openai-agents-python.docs",
            "url": "https://openai.github.io/openai-agents-python/",
            "version": null,
            "verified_at": "2026-08-26T00:00:00Z",
            "claim": "Invocation verified: handoffs, Agent.as_tool"
          }
        ],
        "access": "supported"
      },
      {
        "capability_id": "context.persistent_memory",
        "name": "Persistent memory",
        "category": "context_memory",
        "status": "stable",
        "summary": "Sessions persist conversation state across agent runs.",
        "surfaces": [
          "sessions"
        ],
        "invocation": [
          "SQLiteSession",
          "session"
        ],
        "minimum_version": null,
        "limitations": [],
        "confidence": "verified_official",
        "evidence": [
          {
            "source_id": "src.openai-agents-python.docs",
            "url": "https://openai.github.io/openai-agents-python/",
            "version": null,
            "verified_at": "2026-08-08T20:00:00Z",
            "claim": "Sessions persist conversation state across agent runs."
          },
          {
            "source_id": "src.openai-agents-python.docs",
            "url": "https://openai.github.io/openai-agents-python/sessions/",
            "version": null,
            "verified_at": "2026-08-26T00:00:00Z",
            "claim": "Invocation verified: SQLiteSession, session"
          }
        ],
        "access": "supported"
      },
      {
        "capability_id": "security.permissions",
        "name": "Granular permissions and approvals",
        "category": "security_governance",
        "status": "stable",
        "summary": "Guardrails and tool policies validate inputs, outputs, and actions.",
        "surfaces": [
          "guardrails"
        ],
        "invocation": [
          "input_guardrails",
          "output_guardrails"
        ],
        "minimum_version": null,
        "limitations": [],
        "confidence": "verified_official",
        "evidence": [
          {
            "source_id": "src.openai-agents-python.docs",
            "url": "https://openai.github.io/openai-agents-python/",
            "version": null,
            "verified_at": "2026-08-08T20:00:00Z",
            "claim": "Guardrails and tool policies validate inputs, outputs, and actions."
          },
          {
            "source_id": "src.openai-agents-python.docs",
            "url": "https://openai.github.io/openai-agents-python/",
            "version": null,
            "verified_at": "2026-08-26T00:00:00Z",
            "claim": "Invocation verified: input_guardrails, output_guardrails"
          }
        ],
        "access": "supported"
      },
      {
        "capability_id": "observability.tracing",
        "name": "Agent tracing/event telemetry",
        "category": "observability",
        "status": "stable",
        "summary": "Built-in tracing records agents, generations, tools, handoffs, and guardrails.",
        "surfaces": [
          "tracing"
        ],
        "invocation": [
          "agents.tracing",
          "trace()"
        ],
        "minimum_version": null,
        "limitations": [],
        "confidence": "verified_official",
        "evidence": [
          {
            "source_id": "src.openai-agents-python.docs",
            "url": "https://openai.github.io/openai-agents-python/",
            "version": null,